{
  "$schema": "https://json-schema.org/draft/2020-12/schema",
  "rule_id": "FIT-EVIDENCE-COMPLETE",
  "rule_type": "hard_gate",
  "dimension": "evidence_completeness",
  "scan_command": {
    "command": "python",
    "args": ["scripts/check_evidence_completeness.py"],
    "timeout_seconds": 180
  },
  "pass_criteria": {
    "kind": "exit_code",
    "exit_code": 0
  },
  "description": "检查 evidence pack 是否完整闭合（ADR-020）",
  "severity": "blocker",
  "evidence_binding": {
    "output_file": "evidence/fitness/FIT-EVIDENCE-COMPLETE/output.json",
    "artifact_kind": "command_log"
  },
  "metadata": {
    "owner": "governance",
    "version": "1.0",
    "created_at": "2026-03-17T00:00:00Z"
  }
}
